Title,Organization,Description,Date Info,Deadline,URL,Scraped
2023 ESG Report,morganstanley.com,"The Morgan Stanley ESG Report provides an annual overview of the firm’s approach to and performance on environmental,",—,—,https://www.morganstanley.com/content/dam/msdotcom/en/assets/pdfs/Morgan_Stanley_2023_ESG_Report.pdf,2026-07-07
Climate-related Financial Reporting,about.bankofamerica.com,Download ISSB IFRS S2 disclosure (published December 2025) Our reporting outlines how we are working to realize our climate approach while managing climate-related risks and opportunities.,—,—,https://about.bankofamerica.com/en/making-an-impact/task-force-on-climate-related-financial-disclosures-report,2026-07-07
ESG REPORT | 2024-25,infosys.com,"""The company’s ESG roadmap for 2030 reflects its continued aspiration to be a well-governed model organization for diverse talent with an inclusive workplace and community strategies to leverage technology for good""",—,—,https://www.infosys.com/sustainability/documents/infosys-esg-report-2024-25.pdf,2026-07-09
ESG DISCLOSURE REPORT 2023,unepfi.org,"practices and Environmental, Social and Governance (""ESG"") principles. This report",—,—,https://www.unepfi.org/wordpress/wp-content/uploads/2024/11/ESG-Disclosure-Report-2023.pdf,2026-07-09
esg-report.pdf,asa-international.com,"Financial Statements · Additional Information · Governance Report · Strategic Report · ESG report · Environment · Environment encompasses areas that are · affected by environmental factors, which is · a two-way relationship that involves both the · impact of the Company on the environment ...",—,—,https://www.asa-international.com/media/2379/esg-report.pdf,2026-07-09
2025 Impact Report - S&P Global,spglobal.com,"May 8, 2026 ... This report has been prepared with reference to the Global Reporting Initiative (GRI) Standards, the Sustainability Accounting. Standards Board ...","May 8, 2026","May 8, 2026",https://www.spglobal.com/content/dam/spglobal/corporate/en/documents/organization/who-we-are/2025-Impact-Report.pdf,2026-07-09
Climate-related financial disclosures,ecb.europa.eu,"June 25, 2024 - Climate-related financial disclosures of Eurosystem assets held for monetary policy purposes and of the ECB’s foreign reserves · Disclosures of the ECB’s non-monetary policy portfolios · This report covers the ECB’s non-monetary policy portfolios. The ECB – and all Eurosystem central banks (see list below) – discloses climate-related information on their non-monetary policy portfolios, which they each manage under their own responsibility.",—,—,https://www.ecb.europa.eu/ecb/climate/climate-related-financial-disclosures/html/index.en.html,2026-07-09
Progress Report on Climate-related Disclosures: 2023 Report - Financial Stability Board,fsb.org,"October 12, 2023 - Report presents progress and reviews actions taken by the International Sustainability Standards Board in developing the global minimum baseline disclosures standards as well as by individual jurisdictions and firms in improving climate disclosures.",—,—,https://www.fsb.org/2023/10/progress-report-on-climate-related-disclosures-2023-report/,2026-07-09
Climate Disclosure Actions,climatedisclosure.epic.uchicago.edu,© 2024 Climate Disclosure Explorer.,—,—,https://climatedisclosure.epic.uchicago.edu/timeline,2026-07-09
2025 Environmental Sustainability Report Accelerating progress to 2030,cdn-dynmedia-1.microsoft.com,Environmental Data Fact Sheet. Read about how we report in Appendix A. Customer sustainability · Overview · 57 · Microsoft for Sustainability · 58 · Green software · 60 · Devices · 63 · Gaming · 65 · Arts and culture · 69 · Planetary Computer · 70 · Global sustainability ·,—,—,https://cdn-dynmedia-1.microsoft.com/is/content/microsoftcorp/microsoft/msc/documents/presentations/CSR/2025-Microsoft-Environmental-Sustainability-Report-PDF.pdf,2026-07-10
Sustainability Reports & Case Studies - Google Sustainability,sustainability.google,"Access Google’s sustainability reports, including environmental, product, and supplier responsibility reports and case studies in PDF format.",—,—,https://sustainability.google/google-2025-environmental-report/,2026-07-10
WE’RE DRIVING SUSTAINABILITY SM 2025 SUSTAINABILITY REPORT,sustainability.wm.com,This Sustainability Report details annual · progress on our sustainability initiatives and our · 2030 sustainability goals; available as a PDF · • · The Sustainability Data Center displays data on · many aspects of our sustainability performance · indicators over the last four years ...,—,—,https://sustainability.wm.com/downloads/WM_2025_Sustainability_Report.pdf,2026-07-10
2025 Sustainability Report,about.bankofamerica.com,"December 18, 2025 - financed emissions targets and sustainable finance goal, which may evolve over time and may be the subject of proposed · legislative and regulatory changes across jurisdictions, that may have a significant impact on our future measurement and · reporting, as well as the results of the efforts and programs set forth in this document.",—,—,https://about.bankofamerica.com/content/dam/about/report-center/esg/2025/SustainabilityatBofA2025_WCAG2.2_121625.pdf,2026-07-10
ESG Report 2025,lgtcp.com,"Executive summary Our Environmental, Social and Governance (ESG) Report 2025 is structured around four key chapters that reflect both recent developments in the ESG landscape and our ongoing journey as a responsible investor. Each chapter addresses priority ESG topics and illustrates our approach using selected examples of managers, portfolio companies and firm-level initiatives. Throughout ...",—,—,https://www.lgtcp.com/files/2025-10/lgt_capital_partners_esg_report_2025_web.pdf,2026-07-10
ESG Report 2024-25 - insights.techmahindra.com,insights.techmahindra.com,"This report covers Tech Mahindra’s (TechM) sustainability progress from a broader Environmental, Social and Governance (ESG) perspective. Our report highlights the progress we have made against our sustainability goals and targets aligned with the activities we are undertaking to understand and manage the related risks and opportunities in FY25. In this report, FY25 means FY2024-2025.",—,—,https://insights.techmahindra.com/investors/esg-report-fy2024-25.pdf,2026-07-10
Infosys - ESG Report and Annual Accounts 2024-2025,infosys.com,"Infosys ESG Report 2024-25 - Insights into sustainability, governance, and social impact.",—,—,https://www.infosys.com/about/esg/reports/2024-25.html,2026-07-10
JUNE 2025 Report. 2024 Impact Re - unicef.ca,unicef.ca,"In this year’s Impact Report, you’ll read stories that are often unwritten or unseen in a news feed — the stories of UNICEF that you helped make possible. conflict in Gaza. Or climate-resilient schools in Ecuador that use rainwater and solar panels for renewable energy, teaching students about sustainability while providing schools with acce",—,—,https://www.unicef.ca/sites/default/files/2025-06/UNICEF-2024-Impact-Report-EN.pdf,2026-07-10
CNE Impact Report 2025,thecne.org,"This impact report tells the story of what’s possible when we act with courage, lead with care, and partner with purpose. You’ll read about emerging leaders stepping into their power, boards transforming themselves to reflect the communities they serve, and funders investing in long-term sustainability.",—,—,https://thecne.org/wp-content/uploads/2025/07/CNE-Impact-Report-2025.pdf,2026-07-10
Cargill Impact Report 2025,cargill.com,"This report addresses topics across our three focus areas — Climate, Land and Water, and People — and highlights environmental and social outcomes in our operations, supply chains, and communities. Additional ESG performance details are available in our 2025 Impact Scorecard and Appendix.",—,—,https://www.cargill.com/sustainability/doc/1451372729493/2025-cargill-impact-report.pdf,2026-07-10
Charting the Change: Disclosure Data Dashboard - CDP,cdp.net,"Jan 14, 2025 · Companies disclosing on all three environmental issues - climate change, deforestation and water security - increased significantly in 2024. More holistic data will empower organizations to better assess the environmental risks, impacts and opportunities in their operations, supply chain, product and service offerings and financial decisions.",—,—,https://www.cdp.net/en/insights/disclosure-data-dashboard-2024,2026-07-10
California Corporate Greenhouse Gas Reporting and Climate ...,ww2.arb.ca.gov,"December 23, 2025: CARB has posted copies of the Notice of Public Hearing to Consider the Proposed California Corporate Greenhouse Gas Reporting and Climate-Related Financial Risk Disclosure Initial Regulation, Staff Report, and Proposed Regulation Text. (Note that on December 9, 2025, CARB posted draft proposed rulemaking documents on the ""Resources"" page, which was linked to this webpage ...",—,—,https://ww2.arb.ca.gov/our-work/programs/california-corporate-greenhouse-gas-reporting-and-climate-related-financial-risk,2026-07-10
SEC Proposes Rescission of Climate-Related Disclosure Rules,sec.gov,"May 29, 2026 · The Securities and Exchange Commission today proposed the rescission of overly burdensome and costly rules that require companies to provide certain climate-related information in their registration statements and annual reports. The Commission’s proposal focuses on returning the agency to its core mandate – in line with its legal authority – and restoring a materiality-focused approach ...","May 29, 2026","May 29, 2026",https://www.sec.gov/newsroom/press-releases/2026-49-sec-proposes-rescission-climate-related-disclosure-rules,2026-07-10
The 2026 Progress Report: Climate Risk Reporting in the ...,ceres.org,"May 20, 2026 · This report—2026 Progress Report: Climate Risk Reporting in the U.S. Insurance sector—analyzes climate disclosures from 537 insurance groups, following the TCFD framework's four pillars: governance, strategy, risk management, and metrics and targets. It provides the first comprehensive assessment of disclosure quality among investors.","May 20, 2026","May 20, 2026",https://www.ceres.org/resources/reports/the-2026-progress-report-climate-risk-reporting-in-the-insurance-sector,2026-07-10
