Title,Organization,Description,Date Info,Deadline,URL,Scraped
Green Spa Network Announces 2026 Executive Committee... | Skin Inc.,skininc.com,"Green Spa Network (GSN) has announced its 2026 Executive Committee alongside its upcoming Sustainability Summit, which will take place September 13–16, 2026 at Tanque Verde...",—,—,https://www.skininc.com/home/news/22966141/green-spa-network-gsn-green-spa-network-announces-2026-executive-committee-and-sustainability-summit,2026-05-12
Inaugural Sustainability Summit Convenes A Day... - CleanTechnica,cleantechnica.com,"The inaugural ASEAN-EU Sustainability Summit convened today in Cebu, marking a decisive shift toward private-sector-led solutions for Southeast Asia's green transition.",—,—,https://cleantechnica.com/2026/05/07/inaugural-sustainability-summit-convenes-a-day-before-asean-meeting-begins-in-the-philippines/,2026-05-12
Flooring Sustainability Summit announces 2026 keynote speakers...,fcnews.net,"2026 keynote speakers Washington, D.C.—The Flooring Sustainability Summit will return to here, July 14-16, here at The Mayflower Hotel.",—,—,https://www.fcnews.net/2026/05/flooring-sustainability-summit-announces-2026-keynote-speakers/,2026-05-12
Sustainability LIVE | Sustainability Magazine,sustainabilitymag.com,Sustainability Magazine connects the leading sustainability executives of the world's largest brands.Join us today and shape a sustainable future for generations to come.,—,—,https://sustainabilitymag.com/events/sustainability-live/on-demand/women-leadership-strategy-sustainability-us-summit,2026-05-12
Climate Week NYC 2026 | Climate Group,theclimategroup.org,"Every year, we bring together heads of state, global business leaders, philanthropic leaders, and civil society to accelerate climate action at scale. 2025 marked our biggest year yet: More than 100,000 participants, 5,500 leaders from business ...",—,—,https://www.theclimategroup.org/our-work/events/climate-week-nyc-2026,2026-05-12
About the Climate Weeks | UNFCCC,unfccc.int,"Climate Week 4 will be held in Baku, Azerbaijan, from 7 - 11 September 2026",11 September 2026,Due in 4 months,https://unfccc.int/topics/climate-weeks,2026-05-12
SF Climate Week,sfclimateweek.org,"SF Climate Week — San Francisco's annual gathering for climate action, innovation, and community. April 18–26, 2026.",—,—,https://www.sfclimateweek.org/,2026-05-12
Climate Week | Upcoming Climate Weeks Around the World,climateweeknetwork.org,"Explore 20+ Climate Weeks already announced for 2026 and get involved near you—host an event, offer a venue, or support through sponsorship.",—,—,https://climateweeknetwork.org/,2026-05-12
Annual Resilience symposium 2026: Resilience Research... - YouTube,youtube.com,"2026 Resilience Symposium | Building Strength for a Changing WorldThe 2026 Resilience Symposium brought together thought leaders, practitioners, and change-m...",—,—,https://www.youtube.com/watch?v=WOi4RN6Vc3E,2026-05-12
How Can Cities Build Resilience to Flooding and... — Tech Square ATL,techsquareatl.com,Read more about the presenters in CURA’s 2026 Urban Resilience Leadership Symposium summary. Expert Reflections on the Role of Cities in Climate Resilience.,—,—,https://www.techsquareatl.com/tech-square-news/2026/4/28/how-can-cities-build-resilience-to-flooding-and-drought-experts-distilled-insights-at-curas-2026-symposium,2026-05-12
The Tourism Resilience Symposium 2026 — Guidelines on Tourism...,mlit.go.jp,The Japan Tourism Agency held the “Tourism Resilience Symposium 2026” with the aim of further promoting tourism resilience.,—,—,https://www.mlit.go.jp/kankocho/en/topics07_00001.html,2026-05-12
act.nato.int/activities/resilience-symposium,act.nato.int,resilience-conference-2023.png Resilience Symposium.,—,—,https://www.act.nato.int/activities/resilience-symposium/,2026-05-12
Verdantas is sponsoring and attending the NECA 2026 Environmental...,linkedin.com,"Registration is now OPEN for the 2026 Environmental Conference. Join us on 4/16 in Concord, NH, at the McAuliffe-Shepard Discovery Center for discussions on the environmental costs and benefits of meeting our energy needs.",—,—,https://www.linkedin.com/posts/tom-holden-94483a5b_verdantas-is-sponsoring-and-attending-the-activity-7434617041241878528-3-_4,2026-05-12
