Title,Organization,Description,Date Info,Deadline,URL,Scraped
"Climate events 2026: Conferences, summits and more",thinklandscape.globallandscapesforum.org,"5 days ago - Antalya, Turkey, will host the 2026 UN Climate Change Conference (COP31).",—,—,https://thinklandscape.globallandscapesforum.org/101100/climate-events-2026/,2026-06-23
16th International Conference on Climate Change,heartland.org,"The 16th International Conference on Climate Change, organized by The Heartland Institute, will be held April 8-9 at the Hotel Washington in Washington, DC. It will feature the world’s leading scientists, energy experts, and those making policy in the second Trump administration.",—,—,https://heartland.org/events/16th-international-conference-on-climate-change/,2026-06-24
Resilience 365 Conference 2026,resilience.miami.edu,"We hosted our second annual two-day Resilience 365 Conference on March 17-18, 2026 during Miami Climate Week to bring together thought leaders, researchers, and practitioners to catalyze action related to three primary themes:",—,—,https://resilience.miami.edu/news-and-events/conferences-and-symposia/2026-resilience365-conference/index.html,2026-06-24
2026 NIST-NSF Disaster Resilience Research Symposium | NIST,nist.gov,"2 weeks ago - In cooperation with the National Science Foundation, the Engineering Laboratory at NIST, Gaithersburg, is proud to host the 9th annual symposium featuring the Disaster Resilience Grant Research Program recipients on August 18th-19th, 2026.",—,—,https://www.nist.gov/news-events/events/2026/08/2026-nist-nsf-disaster-resilience-research-symposium,2026-06-24
"Resilience Conference | London, UK",resilienceconference.io,"Join international startups, investors, and government customers on 5-6 October 2026 at Resilience Conference to further innovation in security, defence and resilience.",6 October 2026,Due in 3 months,https://www.resilienceconference.io/,2026-06-24
Environmental Conferences 2026/2027/2028 - Conference Index,conferenceindex.org,"Environmental Conferences 2026 2027 2028 is for the researchers, scientists, scholars, engineers, academic, scientific and university practitioners to present research activities that might want to attend events, meetings, seminars, congresses, workshops, summit, and symposiums.",—,—,https://conferenceindex.org/conferences/environmental,2026-06-24
Climate Changes & Sustainability Conference 2026,environmentalresearchforum.com,Because the Climate Change Conference Paris 2026 puts evidence-based strategies before rhetoric. Attendees will gain direct access to the innovators that are redefining “green tech” today.,—,—,https://environmentalresearchforum.com/,2026-06-25
Graduate Climate Conference 2026,graduateclimateconference.github.io,"The Graduate Climate Conference (GCC) is an interdisciplinary climate conference run by graduate students, for graduate students.Conference Dates November 6 - 8, 2026. Apply Now!",—,—,https://graduateclimateconference.github.io/,2026-06-25
Sustainability Summit - new trade fair and conference for sustainability in business,sustainabilitysummit.eu,"24th & 25th June 2026 in Hamburg Contact: info@sustainabilitysummit.de or +49 40 999 993 865 ... In an era where sustainability is gaining increasing importance in the business world, companies face the challenge of not only acting sustainably ...",—,—,https://sustainabilitysummit.eu/,2026-06-25
Sustainability LIVE: The Global Summit 2026 | Sustainability Magazine,sustainabilitymag.com,"November 6, 2025 - Returning to London on 8–9 September 2026, Sustainability LIVE: The Global Summit is a two-day hybrid conference for senior sustainability executives leading climate and ESG transformation.",9 September 2026,Due in 2 months,https://sustainabilitymag.com/events/sustainability-live/sustainability-live-global-summit-2026,2026-06-25
Sustainability World Summit Frankfurt 2026 | April 23-24 ESG Conference,key-notion.com,"Join the Sustainability World Summit in Frankfurt, April 23-24, 2026. Connect with ESG leaders, explore sustainable business innovations, and advance circular economy transformation strategies.",—,—,https://www.key-notion.com/sustainability-world-summit,2026-06-25
"Climate Week NYC 2026 | September 20–27, New York City",climateweeknyc.org,"Climate Week NYC returns September 20–27, 2026. Join 100,000+ people across 1,000+ events connecting the leaders, ideas, and partnerships driving global climate action.",—,—,https://www.climateweeknyc.org/,2026-06-25
SF Climate Week,sfclimateweek.org,"SF Climate Week — bringing the global climate community to San Francisco. April 18–26, 2026.",—,—,https://www.sfclimateweek.org/,2026-06-25
About the Climate Weeks | UNFCCC,unfccc.int,"Climate Week 4 will be held in Baku, Azerbaijan, from 7 - 11 September 2026",11 September 2026,Due in 2 months,https://unfccc.int/topics/climate-weeks,2026-06-25
Climate Week 2026 – Global Climate & Sustainability Event,climateweek.thepeopleevents.com,"Following the success of previous editions in Frankfurt (2022), Rome (2023), Barcelona (2024), and Milan (2025), Climate Week 2026 will be held in London, United Kingdom, on September 29–30, 2026.",—,—,https://climateweek.thepeopleevents.com/,2026-06-25
Resilience Symposium - NATO's ACT,act.nato.int,The symposium addressed how we can collectively develop and implement resilience planning to underpin credible deterrence and defence of the Alliance.,—,—,https://www.act.nato.int/activities/resilience-symposium/,2026-06-25
Building Resilience Conference | U.S. Chamber of Commerce Foundation,uschamberfoundation.org,"At the U.S. Chamber of Commerce Foundation's 2026 Building Resilience conference, small business owners shared how disasters exposed gaps in their preparedness.",—,—,https://www.uschamberfoundation.org/event-series/building-resilience-conference,2026-06-25
Resilience Symposium,resiliencesymposium.com,Register now for the 2026 edition of Digital Twins for Resilient Urban Environments (DTRUE) to discuss technologies to advance the sustainability of cities ...,—,—,https://resiliencesymposium.com/,2026-06-25
