Title,Organization,Description,Date Info,Deadline,URL,Scraped
"Climate events 2026: Conferences, summits and more",thinklandscape.globallandscapesforum.org,"1 day ago - Antalya, Turkey, will host the 2026 UN Climate Change Conference (COP31).",—,—,https://thinklandscape.globallandscapesforum.org/101100/climate-events-2026/,2026-05-27
Sustainability Summit - Main Page - Bluegrass Greensource,bggreensource.org,"Join us next year on April 16th, 2027, for our 7th annual Sustainability Summit at the University of Kentucky Gatton Student Center.",—,—,https://bggreensource.org/sustainability-summit/,2026-05-27
Flooring Sustainability Summit,flooringsummit.com,"FLOORING Sustainability SUMMIT. July 15 - 16, 2026 | Washington, D.C.. REGISTER NOW.",—,—,https://flooringsummit.com/,2026-05-27
"DC Climate Week | April 20-26, 2026",dcclimateweek.com,"DC Climate Week (DCCW) is a community-organized week of events, exhibitions, tours, screenings, and gatherings across Washington, DC. Together, we will explore the challenges of the climate crisis and discover the solutions that give us hope. Whether you’re deep in the work or just getting started, let’s build community and drive climate action April 20-26, 2026.",—,—,https://www.dcclimateweek.com/,2026-05-27
Climate Week | Upcoming Climate Weeks Around the World,climateweeknetwork.org,"Upcoming Climate Weeks Explore 20+ Climate Weeks already announced for 2026 and get involved near you—host an event, offer a venue, or support through sponsorship. Use this form to express your interest",—,—,https://climateweeknetwork.org/,2026-05-27
Resilience 2026 | A Strategic Renewal Conference,theresilienceconference.com,"Resilience is a conference to renew your passion for church ministry! With special guests Alistair Begg, HB Charles Jr, Shane & Shane, Jarrett Stephens and ...",—,—,https://theresilienceconference.com/,2026-05-27
Building Resilience Conference - U.S. Chamber Foundation,uschamberfoundation.org,"Presented in partnership with Verizon, new research unveiled at Building Resilience 2026 explores the disconnect between small business optimism and ...",—,—,https://www.uschamberfoundation.org/event-series/building-resilience-conference,2026-05-27
2026 South Carolina Resilience Conference,sccoastalinfo.org,"2026 South Carolina Resilience Conference · April 19 - 22, 2026 · Florence, SC 29501 · The Florence Center, 3300 W Radio Dr. Narrative. Discover the healing ...",—,—,https://www.sccoastalinfo.org/events/2026-south-carolina-resilience-conference/,2026-05-27
Dushanbe Water Conference 2026 | Water for Sustainable Development,conf2026.dushanbewaterprocess.org,"4th High-Level International Conference on the International Decade for Action 'Water for Sustainable Development' 2018-2028. Dushanbe, 25-28 May 2026.",28 May 2026,Due today,https://conf2026.dushanbewaterprocess.org/ru,2026-05-27
Climate Changes & Sustainability Conference 2026,environmentalresearchforum.com,Because the Climate Change Conference Paris 2026 puts evidence-based strategies before rhetoric. Attendees will gain direct access to the innovators that are redefining “green tech” today.,—,—,https://environmentalresearchforum.com/,2026-05-28
"UN Climate Change Conference - Antalya, November 2026 | UNFCCC",unfccc.int,"Consider sharing in a digital format before printing onto paper. Process and meetings. Conferences. UN Climate Change Conference - Antalya, November 2026.",—,—,https://unfccc.int/cop31,2026-05-28
Sustainability Summit 2026 Overview – PMI United Kingdom Chapter,pmi.org.uk,"In 2026, we move from awareness to execution. Building on the momentum of previous Sustainability Summits, The Evergreen Project Manager focuses on Green Project Management and...",—,—,https://pmi.org.uk/sustainability-summit-2026/sustainability-summit-2026-overview/,2026-05-28
ASEAN-EU Sustainability Summit 2026 › | SWITCH-Asia,switch-asia.eu,"The ASEAN-EU Sustainability Summit 2026 is a premier regional platform designed to catalyse bold, cross-sectoral action towards Southeast Asia's green and inclusive transition.",—,—,https://www.switch-asia.eu/event/2026/,2026-05-28
Sustainability_Summit_2026,jmi.ac.in,"National Conference on Environmental Sustainability in the 21st Century: Science, society and solutions. Earth day. 22ND april - 23RD april, 2026.",—,—,https://www.jmi.ac.in/upload/EventDetail/des_conference_2026april22_23_brochure.pdf,2026-05-28
Climate Week NYC,climateweeknyc.org,"Climate Week NYC returns: September 20–27, 2026 This year's Climate Week NYC will focus on the energy, the impact, and the action that we drive together. In times of economic and climate uncertainty, collaboration, and learning from one another is key. There’s so much to talk about, so many issues that are driving decision making in boardrooms and at departments. It’s exactly why Climate ...",—,—,https://www.climateweeknyc.org/,2026-05-28
San Francisco Climate Week 2026 Events | Climate Week,sfcw.climate-week.org,"A week of climate innovation, policy, startups, and community events across San Francisco. Connect, collaborate, and accelerate climate solutions.",—,—,https://sfcw.climate-week.org/,2026-05-28
Home - London Climate Action Week,londonclimateactionweek.org,London Climate Action Week 2026 is taking place 20-28 June. It is the largest independent climate event in Europe.,—,—,https://londonclimateactionweek.org/,2026-05-28
about 2026 - Resilience Symposium,resiliencesymposium.com,"In November 2026, the Resilience Symposium returns for its 4th installment, bringing additional partners, the Stuttgart Technical University of Applied Sciences, and the Paris-based think tank, Urban AI.",—,—,https://resiliencesymposium.com/about-2026/,2026-05-28
Symposium 2026 | LIR Mainz - Leibniz-Institut für Resilienzforschung,lir-mainz.de,"Registration deadline: August 31, 2026 Abstract submission deadline: July 31, 2026 Since 2015, the symposium has been gathering the international resilience research community and shaped the field. Examples? See here. The symposium takes place as an in-person meeting.","August 31, 2026",Due in 3 months,https://lir-mainz.de/resilience-symposium,2026-05-28
2026 Central Coast Regional Climate Resilience Symposium - Central ...,centralcoastclimate.org,"The 2026 Central Coast Regional Climate Resilience Symposium, taking place Wednesday, December 9, 2026 in Santa Cruz, CA, will convene hundreds of climate resilience leaders, practitioners, and partners working across the 6-county Central Coast region.","December 9, 2026",Due in 6 months,https://www.centralcoastclimate.org/symposium/,2026-05-28
"E3S Web of Conferences, open access proceedings in environment...",e3s-conferences.org,Volume 712 (2026). 2026 16th International Conference on Future Environment and Energy (ICFEE 2026). See the table of contents. Volume 711 (2026). 2026 2nd International Conference on Environmental Monitoring and Ecological Restoration (EMER 2026).,—,—,https://www.e3s-conferences.org/,2026-05-28
International Conference on Environmental Systems – Enabling...,ices.space,"The conference is open to participants from around the globe spanning academic, government, and space industry organizations.CONFERENCE UPDATES. CATCH EARLY BIRD REGISTRATION by 12 June 2026.",12 June 2026,Due in 2 weeks,https://ices.space/,2026-05-28
Dushanbe Water Conference 2026 | Water for Sustainable Development,conf2026.dushanbewaterprocess.org,"4th High-Level International Conference on the International Decade for Action 'Water for Sustainable Development' 2018-2028. Dushanbe, 25-28 May 2026.",28 May 2026,Deadline passed,https://conf2026.dushanbewaterprocess.org/,2026-05-28
