Title,Organization,Date Info,Description,URL,Scraped
2026 Conference | Climate Change: Impacts & Responses Research...,on-climate.com,In 1 month,"Eighteenth International Conference on Climate Change: Impacts & Responses, University of the Aegean, Rhodes, Greece, 20-22 April 2026 .",https://on-climate.com/2026-conference,2026-03-03
"UN Climate Change Conference - Antalya, November 2026 | UNFCCC",unfccc.int,—,"Consider sharing in a digital format before printing onto paper. Process and meetings. Conferences . UN Climate Change Conference - Antalya, November 2026 .",https://unfccc.int/cop31,2026-03-03
2026 Independent News Sustainability Summit,lionpublishers.com,—,We're heading to San Diego from September 9–11 for our 2026 Independent News Sustainability Summit. Sponsorship opportunities are now available; check out our ...,https://lionpublishers.com/summit-2026/,2026-03-03
2026 SUMMIT | MRSS - Midwest Regional Sustainability Summit,midwestsustainabilitysummit.org,—,"This year's Summit asks: How do we adapt today so we can thrive tomorrow? How can we—across sectors and systems—build the agility, creativity, and collective ...",https://www.midwestsustainabilitysummit.org/2026,2026-03-03
North American Sustainability & Responsibility Summit,executiveplatforms.com,Today,"North American Sustainability & Responsibility Summit · March 1 - March 3, 2026 · Join This Year's Conversation · Featured Speakers · Paulette Frank · Sam Harris.",https://www.executiveplatforms.com/nasrs/,2026-03-03
Welcome - Sustainability Delivery Summit Landing Page,sustainabilitydeliverysummit.com,In 7 months,"The next Sustainability Delivery Summit will take place in London, UK on 8 October 2026. · Sustainability Delivery Awards · Sustainability Delivery Summit London.",https://sustainabilitydeliverysummit.com/,2026-03-03
Home | Climate Change Events| Sustainability... - Climate Week 2026,climateweek.thepeopleevents.com,—,"By participating in Climate Week 2026 , you will have the opportunity to engage in discussions on cutting-edge technologies, sustainability strategies, and climate equity, while connecting...",https://climateweek.thepeopleevents.com/,2026-03-03
Climate Week NYC 2026 (New York City) - Climate ... -- showsbee.com,showsbee.com,—,"Climate Week NYC will bring together CEOs from the world''s leading companies, heads of some of the world''s largest sub-national governments and civil soc. Climate Week NYC 2026 is...",https://www.showsbee.com/fairs/Climate-Week-NYC.html,2026-03-03
"Climate Week NYC (Sep 2026 ), New York USA - Conference",10times.com,—,2026 edition of Climate Week NYC will be held at New York starting on 20th September. It is a 8 day event organised by The Climate Group and will conclude on 27-Sep- 2026 .,https://10times.com/climate-week-nyc-new-york,2026-03-03
Climate Week Home | Climate Week,climateweek.provost.upenn.edu,—,Climate Week 2026 will mark Penn's 7th official observance of Climate Week . Event dates and a theme are being finalized. Questions or ideas about this year’s programming?,https://climateweek.provost.upenn.edu/,2026-03-03
Brain Resilience Symposia | Knight Initiative,brainresilience.stanford.edu,—,"The Knight Initiative for Brain Resilience hosts quarterly symposia throughout the academic year, convening our research community and members of the public to learn about the frontiers...",https://brainresilience.stanford.edu/event-series/brain-resilience-symposia,2026-03-03
International Symposium Resilience of Sea Peoples in Southeast...,maps.toyo.ac.jp,—,14:50-14:55 Introduction — Fujii Shinichi 14:55-15:15 On Indigenous Resilience : The Orang Suku Laut — Cynthia Chou (University of Iowa) 15:15-15:35 Boat as a Nexus Linking Maritime...,https://www.maps.toyo.ac.jp/activity/2026symposium/,2026-03-03
Resilience Symposium - YouTube,youtube.com,—,Resilience Symposium 2022: In Awe of Space - learn about awe and resilience from space experts because everyone deserves to have positive mental health and that certainly includes you.,https://www.youtube.com/channel/UCMTurHR2-W3nZR0jGI-H_JA,2026-03-03
Environmental Conferences 2026/2027/2028 - Conference Index,conferenceindex.org,—,"Environmental Conferences 2026 2027 2028 is for the researchers, scientists, scholars, engineers, academic, scientific and university practitioners to present research activities that might want to attend events, meetings, seminars, congresses, workshops, summit, and symposiums.",https://conferenceindex.org/conferences/environmental,2026-03-03
"Climate events 2026: Conferences, summits and more",thinklandscape.globallandscapesforum.org,—,"4 weeks ago - The European Center of Sustainable Development (ECSDEV), in collaboration with CIT University, is organizing ICSD 2026 under the theme “Creating a Unified Foundation for Sustainable Development: Research, Practice and Education” · The ...",https://thinklandscape.globallandscapesforum.org/101100/climate-events-2026/,2026-03-03
Climate Change Conference 2026: Sustainability Insights,climatechangeconvention.org,—,Join global experts online at the Climate Change Conference 2026 on April 24–25 to discuss sustainability insights and connect worldwide.,https://climatechangeconvention.org/,2026-03-03
World Future Energy Summit | ADNEC Centre Abu Dhabi,worldfutureenergysummit.com,—,"2026 Speakers. Exhibitor Directory. Product Gallery.The World Future Energy Summit 2027 is the leading global event for clean energy, sustainability , and technological innovation.",https://www.worldfutureenergysummit.com/,2026-03-03
Climate Week NYC,climateweeknyc.org,—,"Climate Week NYC returns: September 20–27, 2026 Every year, we bring together heads of state, global business leaders, philanthropic leaders, and civil society to accelerate climate action at scale.",https://www.climateweeknyc.org/,2026-03-03
Climate Week,climateweeknetwork.org,—,"Explore 20+ Climate Weeks already announced for 2026 and get involved near you—host an event, offer a venue, or support through sponsorship. Use this form to express your interest.",https://climateweeknetwork.org/,2026-03-03
Climate Week NYC 2026 | Climate Group,theclimategroup.org,—,"Every year, we bring together heads of state, global business leaders, philanthropic leaders, and civil society to accelerate climate action at scale. 2025 marked our biggest year yet: More than 100,000 participants, 5,500 leaders from business and government and civil society on-site, and 1,000+ events tackling the toughest questions in energy ...",https://www.theclimategroup.org/our-work/events/climate-week-nyc-2026,2026-03-03
"Chicago Climate Week July 18-25, 2026",chiclimateweek.org,—,"Join us for Chicago Climate Week , a hub for climate action and environmental awareness, featuring impactful climate events.",https://chiclimateweek.org/,2026-03-03
The 10th International Symposium on Transport Network Resilience ...,instr2026.sciencesconf.org,—,"📢 Welcome to INSTR 2026 We are pleased to invite you to submit your contribution to the 10th International Symposium on Transport Network Resilience (INSTR 2026 ), which will be held in Lyon, France, from July 15 to 17, 2026 . Following the success of the previous nine editions, INSTR 2026 aims to bring together the world's leading transportation researchers, practitioners, and policymakers ...",https://instr2026.sciencesconf.org/?lang=en,2026-03-03
HOME [isgurp2026.org],isgurp2026.org,In 7 months,"The International Symposium on Geotechnical and Urban Resilience Planning (IS-GURP 2026 ) will be held at Hiroshima University, Japan, on 27-30 September 2026 .",https://isgurp2026.org/,2026-03-03
International Conference on Resilient Systems 2026 - Home,icrs26.org,—,Registration for the International Conference on Resilient Systems 2026 is now open! The conference offers a unique opportunity to delve into the vital aspects of resilience in an era marked by increasing complexity and growing uncertainty.,https://www.icrs26.org/home,2026-03-03
Symposium 2026 | LIR Mainz - Leibniz-Institut für Resilienzforschung,lir-mainz.de,—,"September 23-25, 2026 Mainz, Germany (30 min. from Frankfurt International Airport) September 22: Free Methods Workshop Since 2015, the symposium has been gathering the international resilience research community and shaped the field. Examples? See here. The symposium takes place as an in-person meeting. Get your ticket here!",https://lir-mainz.de/resilience-symposium,2026-03-03
Environmental Conferences in USA 2026/2027/2028 - Conference Index,conferenceindex.org,—,"Environmental Conferences in USA 2026 2027 2028 is for the researchers, scientists, scholars, engineers, academic, scientific and university practitioners to present research activities that might want to attend events, meetings, seminars, congresses, workshops, summit, and symposiums.",https://conferenceindex.org/conferences/environmental/united-states,2026-03-03
Upcoming Environment Conferences in USA 2026 - All Conference Alert,allconferencealert.com,—,"Discover Environment Conferences in USA 2026 which brings together global researchers, industry experts, academicians, and professionals to explore the latest innovations, research trends, and practical applications in the field of Environment.",https://www.allconferencealert.com/usa/environment-conference.html,2026-03-03
"Conferences on Environment in USA 2026, 2027 - Clocate.com",clocate.com,—,"With Conference Locate (Clocate), you can browse events by subject and location. Find information on Conferences on Environment in USA 2026 , 2027 , including dates, locations, price ranges, and more.",https://www.clocate.com/conferences-on+environment+in+usa/c3UtMjUxK2NvLXVz/,2026-03-03
Environment Conferences in 2026/2027/2028,waset.org,—,"environment Conferences 2026 / 2027 /2028 is for the researchers, scientists, scholars, engineers, academic, scientific and university practitioners to present research activities that might want to attend events, meetings, seminars, congresses, workshops, summit, and symposiums.",https://waset.org/environment-conferences,2026-03-03
"GCCC-2026 | Climate Change 2026 | 6th Global Congress on CLIMATE CHANGE | Climate Change Conferences | Sep 09 - 10, 2026 at Paris, France",global-climatechange.com,—,"The GCCC-2026 Conference will be held during September 09-10, 2026 . Welcoming you from all over the world.",https://global-climatechange.com/,2026-03-03
Sustainability LIVE: The US Summit 2026,sustainabilitymag.com,In 1 month,"Sustainability LIVE: The US Summit returns on 21-22 April 2026 . Co-located with Procurement & Supply Chain LIVE: The US Summit brings together the leaders shaping the future of sustainable business. More than 1,000 attendees will gain access to strategic insight, practical solutions and the connections needed to drive measurable progress.",https://sustainabilitymag.com/events/sustainability-live-the-us-summit-2026,2026-03-03
Sustainability LIVE: The US Summit 2026 Returns to Chicago,bizclikmedia.com,—,"The team at BizClik and Sustainability Magazine are bringing back one of North America's most anticipated sustainability events — Sustainability LIVE: The US Summit 2026 , taking place on 21-22 April at Chicago's Navy Pier. Following the success of the inaugural US Summit , this year's edition promises to be even bigger, bolder, and more influential — reflecting the event's ...",https://bizclikmedia.com/sustainability-live-us-summit-chicago-2026,2026-03-03
2026 Midwest Sustainability Summit - Green Umbrella,greenumbrella.org,—,"The Midwest Regional Sustainability Summit is the largest sustainability conference in the Midwest, bringing together 650 passionate and visionary leaders to share inspiring, forward-thinking, and solution-oriented ideas that propel us toward a healthier, more resilient, sustainable, and equitable future.",https://greenumbrella.org/event/2026-midwest-sustainability-summit/,2026-03-03
Climate Weeks,unfccc.int,In 1 month,"Climate Week 1 will be held in Yeosu, the Republic of Korea, from 21 to 25 April 2026 · Climate Week 2 will be held in Baku, Azerbaijan, from 5 to 9 October 2026.",https://unfccc.int/topics/climate-weeks,2026-03-03
Discover Resilience 2026 - Everbridge,everbridge.com,—,"Discover Resilience 2026 is designed for administrators, power users, and resilience leaders from across the Everbridge 360 / Critical Event Management (CEM), ...",https://www.everbridge.com/discover-resilience-2026/,2026-03-03
Resilience Symposium - NATO's ACT,act.nato.int,—,The symposium addressed how we can collectively develop and implement resilience planning to underpin credible deterrence and defence of the Alliance.,https://www.act.nato.int/activities/resilience-symposium/,2026-03-03
This Way to Resilience Symposium - Chico State,csuchico.edu,—,"The third annual This Way to Resilience symposium will be hosted March 26-27, 2026. Check the website in 2026 for more information.",https://www.csuchico.edu/twts/,2026-03-03
Environment Conferences 2026/2027/2028,conferenceindex.org,—,"Environment Conferences 2026 2027 2028 is for the researchers, scientists, scholars, engineers, academic, scientific and university practitioners to present ...",https://conferenceindex.org/conferences/environment,2026-03-03
Sustainability Conferences & Events - ASCE,asce.org,In 1 month,"April 13, 2026. Earth and Space 2026. Mobile, Alabama skyline at dusk. April 25, 2026 - April 29, 2026. 2026 World Environmental & Water Resources Congress.",https://www.asce.org/communities/institutes-and-technical-groups/sustainability/conferences-and-events,2026-03-03
Annual Meetings - International Society for Environmental Epidemiology - ISEE,iseepi.org,—,Want to get a glimpse of what it's like to experience an ISEE conference? Take a look at these captivating moments during ISEE's 35th Annual Conference.,https://www.iseepi.org/annual_meetings.php,2026-03-03
Summer Conference - AERE,aere.org,—,"The next AERE Summer Conference will take place in June 9-11, 2027 in Portland, OR. AERE's signature Summer Conference brings together leading environmental and ...",https://www.aere.org/summer-conference,2026-03-03
TSC Summit 2026 - The Sustainability Consortium,sustainabilityconsortium.org,—,"TSC Summit 2026 brings together leaders from business, NGOs, academia, and government to accelerate progress on the world's most pressing sustainability challenges. Hosted at the state-of-the-art Rob and Melani Walton Center for Planetary Health at Arizona State University, this two-day gathering blends science, collaboration, and action to create real impact across consumer goods supply chains.",https://sustainabilityconsortium.org/tsc-summit/,2026-03-03
"Conferences on Environment 2026, 2027 | Conference Locate ...",clocate.com,—,"Find information on Conferences on Environment 2026 , 2027 , including dates, locations, price ranges, and more.",https://www.clocate.com/conferences-on+environment/c3UtMjUx/,2026-03-03
Albo's $1 billion taxpayer hit to host 2026 climate conference for our...,cairnsnews.org,—,"Each year the United Nations Conference of the Parties, or COP, gathers countries party to the UN Framework Convention on Climate Change (UNFCCC) and the Paris Agreement.",https://cairnsnews.org/2025/11/07/albos-1-billion-taxpayer-hit-to-host-2026-climate-conference-for-our-1-per-cent-co2-contribution/,2026-03-03
"DC Climate Week | April 20-26, 2026",dcclimateweek.com,—,"DC Climate Week (DCCW) is a community-organized week of events, exhibitions, tours, screenings, and gatherings across Washington, DC. Together, we will explore the challenges of the climate crisis and discover the solutions that give us hope. Whether you’re deep in the work or just getting started, let’s build community and drive climate action April 20-26 , 2026 .",https://www.dcclimateweek.com/,2026-03-03
Top 10: Sustainability Events in 2026 | Sustainability Magazine,sustainabilitymag.com,—,"The top events for sustainability leaders in 2026 include Sustainability LIVE: The Global Summit, COP31, Davos and Climate Week NYC",https://sustainabilitymag.com/top10/top-10-sustainability-events-in-2026,2026-03-03
Sustainability LIVE: The US Summit 2026 Comes to Chicago in ...,lite.aol.com,—,"Oct 30, 2025 · The 2026 US Summit will continue this legacy, uniting influential voices and global changemakers to share strategies, insights, and practical solutions for a sustainable future.",https://lite.aol.com/tech/story/0022/20251030/1001136027.htm,2026-03-03
Resilience in Global Health: Inside UNC’s 4th Annual Global Health Scholars Symposium | Institute for Global Health and Infectious Diseases,globalhealth.unc.edu,—,1 day ago - The 4th Annual Global Health Scholars Symposium—sponsored by the Institute for Global Health and Infectious Diseases and the Gillings School of Global Public Health—opened February 13 by emphasizing the resilience of UNC’s global health ...,https://globalhealth.unc.edu/2026/02/resilience-in-global-health-inside-uncs-4th-annual-global-health-scholars-symposium,2026-03-03
ResilienceCon - Life Paths Research Center,lifepathsresearch.org,—,"December 9, 2025 - ResilienceCon 2026 Keynote Speakers · 2026 Keynote Speaker – Jennifer M. Gómez · 2026 Keynote Speaker – Thomas R. Simon · 2026 Keynote Speaker – Christopher Thornton · ResilienceCon 2026 Agenda · 2026 Call for Submissions · Submit to ResilienceCon 2026 ·",https://lifepathsresearch.org/resiliencecon/,2026-03-03
Resilience 2026 | A Strategic Renewal Conference,theresilienceconference.com,—,"Resilience is a conference to renew your passion for church ministry! Join us October 13-15th, 2026 as Jarrett Stephens hosts the conference at Champion Forest Church.",https://theresilienceconference.com/,2026-03-03
2026 Louisiana Environmental Conference and Trade Fair – ERIS...,erisinfo.com,In 3 weeks,"The LOUISIANA ENVIRONMENTAL CONFERENCE & TRADE FAIR is an annual multimedia conference where attendees can learn about the latest regulations and emerging environmental topics, while networking with LDEQ StaffMarch 26, 2026 . Products. Database Reports.",https://www.erisinfo.com/event/2026-louisiana-environmental-conference-and-trade-fair/,2026-03-03
SustainabilitySummit- tickets & registration,sustainabilitysummit.eu,—,Get your tickets forSustainabilitySummit24th & 25th June2026in Hamburg.,https://sustainabilitysummit.eu/registration?discount=WEBWOW25,2026-03-03
CTO Taps Māori Tourism Leader as Keynote for BelizeSustainability...,caribjournal.com,—,Tourism in Full Color Framework. The2026edition of STC is being hosted in collaboration with the Belize Tourism Board.,https://www.caribjournal.com/2026/02/28/belize-sustainability-summit/,2026-03-03
World Future EnergySummit2026Will Bridge Climate Policy And...,go-green.ae,—,"The World Future EnergySummit, hosted by Masdar and part of Abu DhabiSustainabilityWeek (ADSW), will return to Abu Dhabi from January 13–15,2026as its largest and most...",https://www.go-green.ae/world-future-energy-summit-2026-will-bridge-climate-policy-and-action-via-all-new-conference-tracks-events-and-innovations/,2026-03-03
ResilienceSymposiums2026/2027/2028 - Conference Index,conferenceindex.org,—,"ResilienceSymposiums20262027 2028 is for the researchers, scientists, scholars, engineers, academic, scientific and university practitioners to present research activities that might...",https://conferenceindex.org/symposiums/resilience,2026-03-03
Global PoliceResilienceSymposium| The Bronx Daily | Bronx.com,bronx.com,—,"Today marks the beginning of the PoliceResilienceSymposium, co-hosted by Columbia University Irving Medical Center and the New York City Police Department.",https://bronx.com/global-police-resilience-symposium/,2026-03-03
InternationalConferenceon InternationalConferenceon...,conferencenext.com,—,3rd InternationalConferenceon Modern Optimization and Technological Advancement for Resilient Smart Systems(ICMOTARSS-2026).,https://conferencenext.com/event/100286400,2026-03-03
UpcomingEnvironmentConferencesin Amsterdam,allconferencealert.net,—,"15th InternationalConferenceon Recent Challenges in Engineering and Technology. 22nd - 23rd April2026| Bangalore, India.",https://allconferencealert.net/cities/amsterdam/environment.php,2026-03-03
