Name,Role,Organization,LinkedIn,Scraped
Trish Fields,"Executive Director | Clean Energy Sector ...Our team - Climate GroupClimate Power - LinkedInExecutive Director , CarbonPlan - nonprofitoperations.comExecutive Director Nonprofit Climate jobsClimate Group - LinkedInSeema Paul - Program Director at Sequoia Climate ... - LinkedIn","Climate Group? Dominic is Head of Transport overseeing Climate Group’s global transport activity including the ZEV Community, EV100 and EV100+",https://www.linkedin.com/in/trishfields,2026-05-19
Seema Paul,Program Director at Sequoia Climate ... - LinkedIn,—,https://www.linkedin.com/in/seemapaulonlinkedin,2026-05-19
Giana Amador,Absolute Climate | LinkedIn,—,https://www.linkedin.com/in/gianaamador,2026-05-19
Patrick Murphy,"Sierra Club President, Sustainability Speaker, Climate ...",—,https://www.linkedin.com/in/jeremypatrickmurphy,2026-05-19
Meghna Tare,Chief Sustainability Officer - LinkedIn,—,https://www.linkedin.com/in/meghnatare,2026-05-19
"Christine Daugherty, Ph.D., J.D.",Head of Sustainability at Conagra | Board of Directors | Agribusiness and Food Production Advisor | LinkedIn,"Conagra | Board of Directors | Agribusiness and Food Production Advisor · Global leader, with expertise in creating goals and execution plans, managing complex topics, successfully navigating ambiguity, and delivering efficient and profitable results",https://www.linkedin.com/in/christine-daugherty/,2026-05-19
Jessica Hyman,Chief Sustainability Officer at Atlassian | LinkedIn,"UNICEF, on a panel about utilizing AI for impact 🎉 Best of all…the Atlassian Foundation team announced that we will be expanding the discounted license program to social enterprise customers —bringing the best teamwork tools to the orgs doing mission-critical, life-changing work",https://www.linkedin.com/in/jessica-hyman-74baa919/,2026-05-19
Anna Cummins,The 5 Gyres Institute | LinkedIn,—,https://www.linkedin.com/in/anna-cummins-8455785,2026-05-19
