Title,Organization,Description,Date Info,Deadline,URL,Scraped
Resilient Florida Grants - Florida Department of ...,floridadep.gov,"Apply for aGrantGrantDocumentsPlease contact ResilientFloridaGrants@FloridaDEP.gov with any currentgrantquestions.The Resilient Florida Program includes a selection of grants that are available to counties, municipalities, special districts with specific responsibilities and regionalresilienceentities.",—,—,https://floridadep.gov/rcp/resilient-florida-program/content/resilient-florida-grants,2026-04-14
Funding & Capacity | U.S. Climate Resilience Toolkit,toolkit.climate.gov,"Communities are often eligible to apply for grant funding from federal, state, non-profit, or private entities for resilience-building projects. They might also be able to raise funds for resilience actions through taxes or fees.",—,—,https://toolkit.climate.gov/funding-capacity,2026-04-14
Community Resilience Grant Application Form Template | Paperform,paperform.co,"Community Resilience Grant Application. Apply for funding to strengthen community disaster preparedness, build mutual aid networks, support vulnerable populations, and coordinate...",—,—,https://paperform.co/templates/community-resilience-grant-application/,2026-04-15
Adaptation Planning Grant Program - Office of Land Use and ...,lci.ca.gov,"The Adaptation Planning Grant Program (APGP) is designed to fill local, regional, and tribal planning needs, provide communities the resources to identify climate resilience priorities, and support the development of a pipeline of climate resilient infrastructure projects across the state.",—,—,https://lci.ca.gov/climate/icarp/grants/adaptation-planning-grant.html,2026-04-15
Funding Opportunity | U.S. Climate Resilience Toolkit,toolkit.climate.gov,A range of federal agencies and organizations commonly offer funding for climate adaptation or resilience-building projects. Check the external links below for opportunities that align with your needs.,—,—,https://toolkit.climate.gov/funding-opportunity,2026-04-15
Community Resilience Grant Programs - SVCE,svcleanenergy.org,Discover how SVCE grants support resilience in the face of climate change. Learn how Silicon Valley Clean Energy benefits our community.,—,—,https://svcleanenergy.org/community-resilience/,2026-04-15
Community Resilience Grant Program – Sustainability,sustainability.williams.edu,The Community Resilience Grant Program came about in after the switch to remote learning after the start of the pandemic. The format has changed a bit between the summers of 2020 and...,—,—,https://sustainability.williams.edu/getting-involved-on-campus/community-resilience-grant/,2026-04-15
